{
  "packageId": "quick_guide",
  "name": "Quick Guide",
  "version": "1.0.0",
  "description": "Quick guide builder with steps and media management",
  "icon": "static_content/icon.svg",
  "author": "MetaBuilder",
  "category": "ui",
  "dependencies": [],
  "devDependencies": [
    "lua_test"
  ],
  "exports": {
    "components": [
      "StepsEditor",
      "MediaPane",
      "QuickGuideBuilder"
    ],
    "scripts": [
      "init",
      "steps",
      "media"
    ]
  },
  "minLevel": 2,
  "primary": true,
  "permissions": {
    "guide.edit": {
      "minLevel": 3,
      "description": "Edit quick guides"
    },
    "guide.view": {
      "minLevel": 2,
      "description": "View quick guides"
    },
    "guide.create": {
      "minLevel": 3,
      "description": "Create quick guides"
    }
  },
  "seed": {
    "styles": "seed/styles.json"
  }
}
