{
  "packageId": "package_validator",
  "name": "Package Validator",
  "version": "1.0.0",
  "description": "Validates package structure including JSON schemas, Lua files, and folder organization",
  "icon": "static_content/icon.svg",
  "author": "MetaBuilder",
  "category": "tools",
  "primary": true,
  "dependencies": [],
  "devDependencies": [
    "lua_test"
  ],
  "exports": {
    "components": [],
    "scripts": [
      "validate",
      "metadata_schema",
      "component_schema",
      "lua_validator",
      "structure_validator",
      "cli"
    ]
  },
  "tests": {
    "scripts": [
      "tests/metadata.test.lua",
      "tests/component.test.lua",
      "tests/validate.test.lua",
      "tests/lua_validator.test.lua",
      "tests/structure_validator.test.lua",
      "tests/devdependencies.test.lua",
      "tests/parameterized.test.lua"
    ],
    "cases": [
      "tests/cases.json"
    ]
  },
  "minLevel": 5,
  "permissions": {
    "package.validate": {
      "minLevel": 5,
      "description": "Run package validation checks"
    },
    "package.validate.metadata": {
      "minLevel": 5,
      "description": "Validate metadata.json schemas"
    },
    "package.validate.lua": {
      "minLevel": 5,
      "description": "Validate Lua script syntax"
    },
    "package.validate.structure": {
      "minLevel": 5,
      "description": "Validate package folder structure"
    },
    "package.validate.components": {
      "minLevel": 5,
      "description": "Validate component definitions"
    }
  },
  "seed": {
    "styles": "seed/styles.json"
  }
}
