{
  "packageId": "ui_pages",
  "name": "UI Pages Bundle",
  "version": "2.0.0",
  "description": "Meta-package that bundles all UI page packages",
  "icon": "static_content/icon.svg",
  "author": "MetaBuilder",
  "category": "ui",
  "dependencies": [
    "ui_permissions",
    "ui_header",
    "ui_footer",
    "ui_intro",
    "ui_login",
    "ui_home",
    "ui_level2",
    "ui_level3",
    "ui_level4",
    "ui_level5",
    "ui_level6"
  ],
  "devDependencies": [
    "lua_test"
  ],
  "exports": {
    "pages": [],
    "scripts": [],
    "components": []
  },
  "tests": {
    "scripts": [
      "tests/metadata.test.lua",
      "tests/components.test.lua"
    ],
    "cases": [
      "tests/metadata.cases.json",
      "tests/components.cases.json"
    ]
  },
  "minLevel": 1,
  "primary": false,
  "permissions": {
    "pages.bundle.access": {
      "minLevel": 1,
      "description": "Access bundled UI pages"
    }
  },
  "seed": {
    "styles": "seed/styles.json"
  },
  "storybook": {
    "stories": []
  }
}
